<?xml version="1.0" encoding="UTF-8"?>
<!--
To change this license header, choose License Headers in Project Properties.
To change this template file, choose Tools | Templates
and open the template in the editor.
-->


<bookings xmlns:xsi="http://www.w3.org/2001/XMLSchema-instance" xsi:schemaLocation="bookings.xsd">
    <booking>
        <bookingID>1</bookingID>
        <tutorName>Ryan</tutorName>
        <tutorEmail>ryan@gmail.com</tutorEmail>
        <subject>WSD</subject>
        <studentName>Sarah</studentName>
        <studentEmail>firstEmail@yahoo.com</studentEmail>
        <status>active</status>
    </booking>
    <booking>
        <bookingID>2</bookingID>
        <tutorName>Luke</tutorName>
        <tutorEmail>luke@gmail.com</tutorEmail>
        <subject>SEP</subject>
        <studentName>Simran</studentName>
        <studentEmail>simran@gmail.com</studentEmail>
        <status>active</status>
    </booking>
</bookings>

